{"adapters":[{"product_family":"short_range","status":"fixture_enabled"},{"product_family":"ultra_short","status":"contract_only_disabled"},{"product_family":"mid_term","status":"contract_only_disabled"}],"cohorts":[{"cohort_id":"3e99407bce157c253dd4f4c1","evidence_gate_version":"metric-evidence-gate/v1","evidence_state":"sufficient","excluded_counts":{},"expected_count":80,"grid_scope":"seoul_kma_80","limitations":["Synthetic fixtures prove contract behavior, not current Seoul forecast accuracy.","Metrics are valid only for the declared product, variable, vintage, grid universe, and evaluation window."],"matched_coverage":1.0,"metric_family":"probabilistic","metric_metadata":{"categorical":{"accuracy":{"direction":"higher_is_better","unit":"ratio"},"f1":{"direction":"higher_is_better","unit":"ratio"},"false_negative":{"direction":"lower_is_better","unit":"count"},"false_positive":{"direction":"lower_is_better","unit":"count"},"positive_prevalence":{"direction":"descriptive","unit":"ratio"},"precision":{"direction":"higher_is_better","unit":"ratio"},"recall":{"direction":"higher_is_better","unit":"ratio"},"true_negative":{"direction":"descriptive","unit":"count"},"true_positive":{"direction":"descriptive","unit":"count"}},"probabilistic":{"brier_score":{"direction":"lower_is_better","unit":"probability_squared"},"expected_calibration_error":{"direction":"lower_is_better","unit":"ratio"}}},"metrics":{"categorical":{"accuracy":1.0,"f1":1.0,"false_negative":0,"false_positive":0,"metric_family":"categorical","positive_prevalence":0.5,"precision":1.0,"recall":1.0,"sample_count":80,"true_negative":40,"true_positive":40},"probabilistic":{"brier_score":0.04,"calibration_bins":[{"bin_index":0,"lower_bound":0.0,"lower_inclusive":true,"mean_forecast_probability":null,"observed_frequency":null,"sample_count":0,"upper_bound":0.1,"upper_inclusive":false,"weighted_absolute_calibration_gap":0.0},{"bin_index":1,"lower_bound":0.1,"lower_inclusive":true,"mean_forecast_probability":0.2,"observed_frequency":0.0,"sample_count":40,"upper_bound":0.2,"upper_inclusive":false,"weighted_absolute_calibration_gap":0.1},{"bin_index":2,"lower_bound":0.2,"lower_inclusive":true,"mean_forecast_probability":null,"observed_frequency":null,"sample_count":0,"upper_bound":0.3,"upper_inclusive":false,"weighted_absolute_calibration_gap":0.0},{"bin_index":3,"lower_bound":0.3,"lower_inclusive":true,"mean_forecast_probability":null,"observed_frequency":null,"sample_count":0,"upper_bound":0.4,"upper_inclusive":false,"weighted_absolute_calibration_gap":0.0},{"bin_index":4,"lower_bound":0.4,"lower_inclusive":true,"mean_forecast_probability":null,"observed_frequency":null,"sample_count":0,"upper_bound":0.5,"upper_inclusive":false,"weighted_absolute_calibration_gap":0.0},{"bin_index":5,"lower_bound":0.5,"lower_inclusive":true,"mean_forecast_probability":null,"observed_frequency":null,"sample_count":0,"upper_bound":0.6,"upper_inclusive":false,"weighted_absolute_calibration_gap":0.0},{"bin_index":6,"lower_bound":0.6,"lower_inclusive":true,"mean_forecast_probability":null,"observed_frequency":null,"sample_count":0,"upper_bound":0.7,"upper_inclusive":false,"weighted_absolute_calibration_gap":0.0},{"bin_index":7,"lower_bound":0.7,"lower_inclusive":true,"mean_forecast_probability":null,"observed_frequency":null,"sample_count":0,"upper_bound":0.8,"upper_inclusive":false,"weighted_absolute_calibration_gap":0.0},{"bin_index":8,"lower_bound":0.8,"lower_inclusive":true,"mean_forecast_probability":0.8,"observed_frequency":1.0,"sample_count":40,"upper_bound":0.9,"upper_inclusive":false,"weighted_absolute_calibration_gap":0.1},{"bin_index":9,"lower_bound":0.9,"lower_inclusive":true,"mean_forecast_probability":null,"observed_frequency":null,"sample_count":0,"upper_bound":1.0,"upper_inclusive":true,"weighted_absolute_calibration_gap":0.0}],"expected_calibration_error":0.2,"metric_family":"probabilistic","sample_count":80}},"population_revision":"seoul_kma_80:ed99fc182211cacfb61409a34b85dee7db95742a1adbb7eb47d0624698370c7d","product_family":"short_range","sample_count":80,"truth_policy_version":"observation-truth-policy/v1","truth_revisions":["fixture-truth-v1"],"truth_sources":["synthetic_observation_fixture"],"unit":"1","valid_from":"2026-08-20T03:00:00Z","valid_to":"2026-08-20T03:00:00Z","variable":"precipitation_occurrence","vintage_label":"D-1"},{"cohort_id":"3a0ea860badb0e44329b09ba","evidence_gate_version":"metric-evidence-gate/v1","evidence_state":"sufficient","excluded_counts":{},"expected_count":80,"grid_scope":"seoul_kma_80","limitations":["Synthetic fixtures prove contract behavior, not current Seoul forecast accuracy.","Metrics are valid only for the declared product, variable, vintage, grid universe, and evaluation window."],"matched_coverage":1.0,"metric_family":"probabilistic","metric_metadata":{"categorical":{"accuracy":{"direction":"higher_is_better","unit":"ratio"},"f1":{"direction":"higher_is_better","unit":"ratio"},"false_negative":{"direction":"lower_is_better","unit":"count"},"false_positive":{"direction":"lower_is_better","unit":"count"},"positive_prevalence":{"direction":"descriptive","unit":"ratio"},"precision":{"direction":"higher_is_better","unit":"ratio"},"recall":{"direction":"higher_is_better","unit":"ratio"},"true_negative":{"direction":"descriptive","unit":"count"},"true_positive":{"direction":"descriptive","unit":"count"}},"probabilistic":{"brier_score":{"direction":"lower_is_better","unit":"probability_squared"},"expected_calibration_error":{"direction":"lower_is_better","unit":"ratio"}}},"metrics":{"categorical":{"accuracy":1.0,"f1":1.0,"false_negative":0,"false_positive":0,"metric_family":"categorical","positive_prevalence":0.5,"precision":1.0,"recall":1.0,"sample_count":80,"true_negative":40,"true_positive":40},"probabilistic":{"brier_score":0.09,"calibration_bins":[{"bin_index":0,"lower_bound":0.0,"lower_inclusive":true,"mean_forecast_probability":null,"observed_frequency":null,"sample_count":0,"upper_bound":0.1,"upper_inclusive":false,"weighted_absolute_calibration_gap":0.0},{"bin_index":1,"lower_bound":0.1,"lower_inclusive":true,"mean_forecast_probability":null,"observed_frequency":null,"sample_count":0,"upper_bound":0.2,"upper_inclusive":false,"weighted_absolute_calibration_gap":0.0},{"bin_index":2,"lower_bound":0.2,"lower_inclusive":true,"mean_forecast_probability":null,"observed_frequency":null,"sample_count":0,"upper_bound":0.3,"upper_inclusive":false,"weighted_absolute_calibration_gap":0.0},{"bin_index":3,"lower_bound":0.3,"lower_inclusive":true,"mean_forecast_probability":0.3,"observed_frequency":0.0,"sample_count":40,"upper_bound":0.4,"upper_inclusive":false,"weighted_absolute_calibration_gap":0.15},{"bin_index":4,"lower_bound":0.4,"lower_inclusive":true,"mean_forecast_probability":null,"observed_frequency":null,"sample_count":0,"upper_bound":0.5,"upper_inclusive":false,"weighted_absolute_calibration_gap":0.0},{"bin_index":5,"lower_bound":0.5,"lower_inclusive":true,"mean_forecast_probability":null,"observed_frequency":null,"sample_count":0,"upper_bound":0.6,"upper_inclusive":false,"weighted_absolute_calibration_gap":0.0},{"bin_index":6,"lower_bound":0.6,"lower_inclusive":true,"mean_forecast_probability":null,"observed_frequency":null,"sample_count":0,"upper_bound":0.7,"upper_inclusive":false,"weighted_absolute_calibration_gap":0.0},{"bin_index":7,"lower_bound":0.7,"lower_inclusive":true,"mean_forecast_probability":0.7,"observed_frequency":1.0,"sample_count":40,"upper_bound":0.8,"upper_inclusive":false,"weighted_absolute_calibration_gap":0.15},{"bin_index":8,"lower_bound":0.8,"lower_inclusive":true,"mean_forecast_probability":null,"observed_frequency":null,"sample_count":0,"upper_bound":0.9,"upper_inclusive":false,"weighted_absolute_calibration_gap":0.0},{"bin_index":9,"lower_bound":0.9,"lower_inclusive":true,"mean_forecast_probability":null,"observed_frequency":null,"sample_count":0,"upper_bound":1.0,"upper_inclusive":true,"weighted_absolute_calibration_gap":0.0}],"expected_calibration_error":0.3,"metric_family":"probabilistic","sample_count":80}},"population_revision":"seoul_kma_80:ed99fc182211cacfb61409a34b85dee7db95742a1adbb7eb47d0624698370c7d","product_family":"short_range","sample_count":80,"truth_policy_version":"observation-truth-policy/v1","truth_revisions":["fixture-truth-v1"],"truth_sources":["synthetic_observation_fixture"],"unit":"1","valid_from":"2026-08-20T03:00:00Z","valid_to":"2026-08-20T03:00:00Z","variable":"precipitation_occurrence","vintage_label":"D-2"},{"cohort_id":"7a4eba4a9da8e4660ee79d37","evidence_gate_version":"metric-evidence-gate/v1","evidence_state":"sufficient","excluded_counts":{},"expected_count":80,"grid_scope":"seoul_kma_80","limitations":["Synthetic fixtures prove contract behavior, not current Seoul forecast accuracy.","Metrics are valid only for the declared product, variable, vintage, grid universe, and evaluation window."],"matched_coverage":1.0,"metric_family":"probabilistic","metric_metadata":{"categorical":{"accuracy":{"direction":"higher_is_better","unit":"ratio"},"f1":{"direction":"higher_is_better","unit":"ratio"},"false_negative":{"direction":"lower_is_better","unit":"count"},"false_positive":{"direction":"lower_is_better","unit":"count"},"positive_prevalence":{"direction":"descriptive","unit":"ratio"},"precision":{"direction":"higher_is_better","unit":"ratio"},"recall":{"direction":"higher_is_better","unit":"ratio"},"true_negative":{"direction":"descriptive","unit":"count"},"true_positive":{"direction":"descriptive","unit":"count"}},"probabilistic":{"brier_score":{"direction":"lower_is_better","unit":"probability_squared"},"expected_calibration_error":{"direction":"lower_is_better","unit":"ratio"}}},"metrics":{"categorical":{"accuracy":1.0,"f1":1.0,"false_negative":0,"false_positive":0,"metric_family":"categorical","positive_prevalence":0.5,"precision":1.0,"recall":1.0,"sample_count":80,"true_negative":40,"true_positive":40},"probabilistic":{"brier_score":0.16,"calibration_bins":[